name,price
나리몽 UV 젖병소독기,"149,000원"
유팡 시그니처2 젖병 소독기 UP920A,"328,220원"
해님 미니 UV LED 자외선 젖병 소독기 HN-M1,"138,000원"
지능 젖병소독기 20L UV 건조 2in1 소독기 가정용 젖병살균기,"61,100원"
리빙웰 베이비스타 4in1 스팀 살균 건조 젖병소독기 스테인레스 열탕 보틀워머,"105,280원"
한일 젖병소독기 UV LED 램프 젖병 식기 건조기 소독기 출산선물,"188,000원"
에코맘 젖병 소독기 ECO-33,"176,000원"
폴레드 픽셀 젖병살균기 + 맘마존트레이 세트,"298,050원"
닥터하르 2in1 분유포트 젖병 소독기 올인원 일체형 UV 살균기,"308,000원"
해님 UV LED 젖병소독기 4세대 플러스 HN-04L,"238,000원"
나리몽 밀크박스 젖병소독기 분유포트 보온 분유쉐이커 올인원,"199,000원"
보아르 아가 맘마 보틀워머 분유 젖병 중탕 살균기,"57,800원"
나리몽 밀크박스 젖병소독기 분유포트 보온 분유쉐이커 올인원,"199,000원"
콕스타 젖병 소독기 UV살균 건조기 젖병 살균기 소독기 출산준비물,"299,000원"
베이비브레짜 스팀 건조 젖병소독기 BRZSDA-1B,"149,000원"
한일 UV 식기건조기 살균기 그릇 젖병 소독기 가정용 4인용 스텐 26년 신제품,"199,000원"
퍼펙션 일체형 스팀 젖병소독기 분유포트,"93,850원"
해님 UV LED 젖병소독기 4세대 플러스,"238,000원"
나리몽 UV 젖병소독기,"149,000원"
보본 맘마 스테인레스 열탕 젖병소독기 VB-BS800W,"99,000원"
Mochae 자외선 살균기 UV 소독기 소형 건조기 네일 미용도구 타올 소독 3단 모드 조절 다용도 고온 식기건조기 젖병소독 멸균기 대용량 10L,"56,220원"
필립스아벤트 3 in 1 스팀 건조 일체형 젖병소독기 SCF293/00,"141,550원"
폴레드 픽셀 슬림업 UVC LED 젖병소독기 PXUVS41,"305,000원"
폴레드 픽셀 젖병살균기 + 맘마존 트레이,"298,050원"
하우지안 UV 살균기 젖병소독기,"49,900원"
보아르 아가 맘마 보틀워머 분유 젖병 중탕 살균기,"57,800원"
리빙웰 베이비스타 4in1 스팀 살균 건조 젖병소독기 스테인레스 열탕 보틀워머,"105,280원"
폴레드 픽셀 슬림업 UVC LED 젖병소독기 PXUVS41,"305,000원"
가정용 델키 램프교체 걱정없는 5세대 UV-C 식기 살균건조기 DK-UV500 젖병소독기 식기소독기 학교 어린이집 필수품,"188,200원"
스펙트라 UV LED 젖병 소독기 SPES-03,"281,700원"
스펙트라 UV 젖병소독기 (램프2+2 추가증정),"233,000원"
델리팬 UV LED 클린뷰 젖병소독기 DEL-BS12,"160,730원"
위드닉스 미니 젖병소독기 유아용품소독기 식기살균건조기 22L 화이트,"49,900원"
소유 SOYU UVC LED 프리미엄 젖병소독기 출산선물,"186,000원"
업소용 살균 소독기 스테인레스 주방용 가정용 대용량 살균 소독기 식당용 유아 카페 젖병 유리 강화단일상품,"518,400원"
리빙플랜 에코맘 젖병살균기 ECO-22 일반형 살균+건조+탈취 (325x340x403/젖병12개),"219,000원"
나리몽 UV 젖병소독기,"149,000원"
Mochae 젖병소독기 젖병살균기 젖병 세척기 스팀 건조 스마트 멀티 중탕살균기,"29,350원"
리빙웰 베이비스타 4in1 스팀 살균 건조 젖병소독기 스테인레스 열탕 보틀워머,"105,280원"
가정용 젖병살균기 젖병보관함 젖병건조대 소독기 식기살균건조기,"26,500원"
케이 젖병소독기,"315,000원"
보아르 아가맘마 멀티 분유포트 젖병 스팀 살균기,"127,000원"
한일 젖병소독기 UV LED 램프 젖병 식기 건조기 소독기 출산선물,"188,000원"
220V 젖병 살균기 일체형 기계 건조 기능 포함 투인원 아기 특수 자외선 소형 가정용 소독 A,"307,000원"
해님 UV LED 스마트뷰 젖병 소독기,"188,000원"
한일 젖병소독기 UV LED 램프 젖병 식기 건조기 소독기 출산선물,"189,000원"
닥터하르 2in1 분유포트 젖병 소독기 올인원 일체형 UV 살균기,"308,000원"
베이비부스트 유아용 스마트 UVC LED 젖병살균기,"184,920원"
나리몽 밀크박스 젖병소독기 분유포트 보온 분유쉐이커 올인원,"199,000원"
독일 힐베르 스텐 식기 그릇 자외선 도마 UV 살균 건조기 건조대 젖병 소독기 설거지건조대 칼 수저 싱크대 소독기,"98,000원"
건조 기능 A가 있는 아기 젖병 소독 건조기용 220V 다목적 휴대용 UV 살균기 상자,"190,300원"
필립스아벤트 3 in 1 스팀 건조 일체형 젖병소독기 SCF293/00,"141,550원"
베이비부스트 유아용 스마트 UVC LED 젖병살균기 BBE2003A,"184,920원"
한일 포그니 젖병소독기 출산 신생아 선물 젖병 건조 UVC 살균기 젖뗀후 식품건조기로 사용,"189,000원"
닥터하르 2in1 분유포트 젖병 소독기 올인원 일체형 UV 살균기,"308,000원"
건조 기능 A가 있는 아기 젖병 소독 건조기용 220V 다목적 휴대용 UV 살균기 상자,"203,900원"
보아르 아가맘마 멀티 분유포트 젖병 스팀 살균기,"127,000원"
하우스터 UV LED 젖병 소독기 살균기 건조기,"49,500원"
보아르 아가 맘마 보틀워머 분유 젖병 중탕 살균기,"57,800원"
Mochae 자외선 살균기 UV 소독기 소형 건조기 네일 미용도구 타올 소독 3단 모드 조절 다용도 고온 식기건조기 젖병소독 멸균기 대용량 10L,"56,220원"
가정용 젖병살균기 젖병보관함 젖병건조대 소독기 식기살균건조기,"26,500원"
[스미다] UV 다용도 살균기 젖병소독기 마스크 칫솔 살균기 SMD-SAB100단품,"51,000원"
에르제 스팀 젖병소독기 MNL-402,"99,000원"
건조 기능 A가 있는 아기 젖병 소독 건조기용 220V 다목적 휴대용 UV 살균기 상자,"203,900원"
폴레드 픽셀 젖병살균기 + 맘마존트레이 세트,"298,050원"
한일 젖병소독기 UV LED 램프 젖병 식기 건조기 소독기 출산선물,"188,000원"
폴레드 픽셀 젖병살균기 + 맘마존트레이 세트,"298,050원"
BONVIE 본비 UV살균 식기건조기 유아용건조대 젖병건조대 세트 BV-101,"71,100원"
휴대용 젖병 미니 UV-C LED 99.9% 살균 소독기 유베베 nys+581qn,"59,190원"
소유 SOYU UVC LED 프리미엄 젖병소독기 출산선물,"189,000원"
디오첸 젖병 전기 소독기 LED,"169,900원"
소유 SOYU UVC LED 프리미엄 젖병소독기 출산선물,"189,000원"
나리몽 UV 젖병소독기,"149,000원"
케이 젖병소독기,"315,000원"
리빙웰 베이비스타 4in1 스팀 살균 건조 젖병소독기 스테인레스 열탕 보틀워머,"105,280원"
한일 젖병소독기 UV LED 램프 젖병 식기 건조기 소독기 출산선물,"188,000원"
스펙트라 스펙트라젖병소독기 uv 젖병소독기,"232,480원"
링크 휴대용 UV 쪽쪽이/장난감 살균기/국내생산/젖병소독기,"23,000원"
닥터하르 2in1 분유포트 젖병 소독기 올인원 일체형 UV 살균기,"308,000원"
나리몽 밀크박스 젖병소독기 분유포트 보온 분유쉐이커 올인원,"199,000원"
스펙트라 UV-LED 컬러에디션 젖병소독기 (공식대리점),"294,000원"
가정용 델키 램프교체 걱정없는 5세대 UV-C 식기 살균건조기 DK-UV500 젖병소독기 식기소독기 학교 어린이집 필수품,"188,200원"
보아르 아가 맘마 보틀워머 분유 젖병 중탕 살균기,"57,800원"
UV 젖병살균기 케이 젖병소독기 DY-00001-01 (구매Gift) 영유아용품 5개항목 살균인증 듀얼살균시스템 건조 살균 멸균보관 대영케이하이테크_국내생산 A/S 2년],"359,000원"
가정용 식기 살균 수저 열풍 건조기 대용량 젖병 고온 전기 컬 컵 그릇 소독기,"214,800원"
델키 스팀 워머 젖병 소독기,"67,900원"
하우지안 UV 살균기 젖병소독기,"79,800원"
병원 젖병소독기 그릇 접시 살균기 수저건조기계 컵50개,"268,000원"
필립스아벤트 3 in 1 스팀 건조 일체형 젖병소독기 SCF293/00,"141,550원"
스펙트라 스팀소독백 5매입/휴대용 젖병소독백 전자레인지로 간편소독 외출용품,"6,500원"
베이비부스트 스마트 스팀 살균 젖병소독기 BBE3001,"106,810원"
리빙플랜 에코맘 젖병살균기 ECO-22 일반형 살균+건조+탈취 (325x340x403/젖병12개),"219,000원"
유베베 UV 자외선 휴대용 쪽쪽이 젖병 살균기 소독기- Made In KOREA! 출산임신선물 육아용품 추천 [ NS-100 ],"39,000원"
나리몽 UV 젖병소독기,"149,000원"
버들 전기 젖병 식기 세척기 Buddle i,"347,000원"
스펙트라 컬러에디션 UV LED 젖병소독기,"294,000원"
유팡 젖병 블루케어 소독기 적외선 30W / 자외선 살균 4W 램프 필립스 G4T5 TUV 4W,"8,200원"
리빙웰 베이비스타 4in1 스팀 살균 건조 젖병소독기 스테인레스 열탕 보틀워머,"105,280원"
"하이비 젖병 젖꼭지 세척솔 몽글이 롱 미니솔 5p + 먼지보호캡 3p, 1세트, 따뜻한햇살","13,900원"
콕스타 젖병 소독기 UV살균 건조기 젖병 살균기 소독기 출산준비물,"299,000원"
케이 젖병소독기,"315,000원"
스펙트라 UV 젖병소독기,"233,000원"
나리몽 UV 젖병소독기,"149,000원"
한일 젖병소독기 UV LED 램프 젖병 식기 건조기 소독기 출산선물,"189,000원"
델키 스팀 젖병소독기 워머기,"78,000원"
케이 젖병소독기,"315,000원"
링크 휴대용 UV 쪽쪽이/장난감 살균기/국내생산/젖병소독기,"23,000원"
리빙웰 베이비스타 4in1 스팀 살균 건조 젖병소독기 스테인레스 열탕 보틀워머,"105,280원"
가정용 식기 살균 수저 열풍 건조기 대용량 젖병 고온 전기 컬 컵 그릇 소독기,"193,300원"
라플루 버들 아이 젖병소독기 전용세제 식기세척기 젖병세제 100% 1종 원료 1kg 버들 맘마,"22,300원"
필립스아벤트 3 in 1 스팀 건조 일체형 젖병소독기 SCF293/00,"141,550원"
가정용 델키 램프교체 걱정없는 5세대 UV-C 식기 살균건조기 DK-UV500 젖병소독기 식기소독기 학교 어린이집 필수품,"188,200원"
베이비부스트 스마트 UVC LED 살균 젖병소독기 BBE2003A,"229,000원"
맘마존 F 분유존 젖병소독기 선반 국내생산,"39,700원"
디오첸 젖병소독기 UV살균기 젖병건조기 출산선물,"167,990원"
소유 SOYU UVC LED 프리미엄 젖병소독기 출산선물,"189,000원"
보아르 아가맘마 멀티 분유포트 젖병 스팀 살균기,"127,000원"
보아르 아가 맘마 보틀워머 분유 젖병 중탕 살균기,"57,800원"
필립스아벤트 3 in 1 스팀 건조 일체형 젖병소독기 SCF293/00,"141,550원"
가정용 식기 살균 수저 열풍 건조기 대용량 젖병 고온 전기 컬 컵 그릇 소독기,"190,300원"
베이비부스트 스마트 스팀 살균 젖병소독기 BBE3001,"106,810원"
유베베 UV 자외선 휴대용 쪽쪽이 젖병 살균기 소독기- Made In KOREA! 출산임신선물 육아용품 추천 [ NS-100 ],"39,000원"
리빙플랜 에코맘 젖병살균기 ECO-22 일반형 살균+건조+탈취 (325x340x403/젖병12개),"219,000원"
버들 전기 젖병 식기 세척기 Buddle i,"347,000원"
